{
  "rcr_version": "1.0.0-rc1",
  "receipt_id": "sendgrid:14c5d75ce93.dfd.64b469@ismtpd0001p1iad1.sendgrid.net",
  "issued_at": "2026-05-30T17:43:11.000Z",
  "source": {
    "vendor": "sendgrid",
    "product": "mail-send",
    "api_version": "v3"
  },
  "action": {
    "class": "mail.send",
    "subject": {
      "to": "compliance@regulator.example",
      "subject_line": "Q1 audit response"
    },
    "effect": "delivered"
  },
  "evidence": {
    "vendor_payload_hash": "1a2b3c4d5e6f70819204a3b5c7d9e1f0a2b4c6d8e0f1a3b5c7d9e1f0a2b4c6d8",
    "dkim": "v=1; a=rsa-sha256; d=example.org; s=mail; t=1748627591; bh=Zx9...; b=k8j...",
    "vendor_signature": "BASE64_SENDGRID_EVENT_WEBHOOK_SIG_PLACEHOLDER="
  },
  "chain": {
    "previous_receipt_hash": null,
    "agent_event_hash": "a1b2c3d4e5f6071829304a5b6c7d8e9f0a1b2c3d4e5f607182930a1b2c3d4e5f",
    "binding_proof": null
  },
  "claim": {
    "strength": "vendor_signed",
    "what_proven": "SendGrid's outbound MTA observed and accepted this message and emitted an event-webhook signature confirming delivered status to the recipient MX.",
    "what_not_proven": "That the recipient or any human read the message; that the message reached the inbox rather than a spam folder."
  },
  "integrity": {
    "canonicalization": "rcr-jcs-1",
    "hash_alg": "sha256",
    "receipt_hash": "ba5eba110011223344556677889900aabbccddeeff0011223344556677889900"
  }
}
